1,安藤 純典,アンドウ スミノリ,男,A,1980/5/1,0562-07-4180,070-7279-5761,ironimus2006@freeml.co.jp ,470-1141,愛知県豊明市阿野町2006,アイチケントヨアケシアノチョウ
2,鈴木 美砂,スズキ ミサ,女,B,1982/2/25,011-138-3567,090-9724-1121,misa_suzuki@sannet.ne.jp ,060-0008,北海道札幌市中央区北八条西9-1-1 北八条西第1ビル 1513,ホッカイドウサッポロシチュウオウクキタ８ジョウニシ
3,三宅 慎治,ミヤケ シンジ,男,B,1978/1/13,0255-38-1342,070-9698-6839,snz@excite.com ,949-2113,新潟県妙高市杉野澤5-12-3 ル・メール杉野澤 14階,ニイガタケンミョウコウシスギノサワ
4,三浦 幸人,ミウラ ユキト,男,A,1994/6/18,03-3536-7373,070-0181-7290,tky@rakuten.co.jp ,152-0035,東京都目黒区自由が丘8-4-7 ローレル自由が丘 4階,トウキョウトメグロクジユウガオカ
5,出口 恭造,デグチ キョウゾウ,男,B,1984/1/8,042-082-2224,090-1179-2451,ituged@gmo-media.jp ,182-0005,東京都調布市東つつじヶ丘1-15-3,トウキョウトチョウフシヒガシツツジガオカ
6,田島 聡,タシマ アキラ,男,A,1973/5/4,079-689-5820,090-5290-5984,akr_tsmgmail@gmail.com ,669-2541,兵庫県篠山市井串2-10-1 フリード井串,ヒョウゴケンササヤマシイクシ
7,鈴木 利次,スズキ トシジ,男,A,1985/9/3,0237-99-9720,,tsz999@hi-ho.ne.jp ,999-3701,山形県東根市東根甲3-14-9,ヤマガタケンヒガシネシヒガシネコウ
8,谷川 禎二,ヤガワ テイジ,男,B,1991/12/9,0566-14-9563,090-4523-4311,iziet444@hi-ho.ne.jp ,444-1152,愛知県安城市川島町1-6-7,アイチケンアンジョウシカワシマチョウ
9,荒木 泰秀,アラキ ヤスヒデ,男,O,1979/12/31,03-3325-3004,070-6024-4044,dhsy1231@sakura.ne.jp ,166-0014,東京都杉並区松ノ木1-4-8,トウキョウトスギナミクマツノキ
10,平岡 吉治,ヒラオカ キチジ,男,O,1974/8/25,0299-80-5982,070-0941-5151,hrok_ktz@example.org ,319-0101,茨城県小美玉市橋場美3-3-8,イバラキケンオミタマシハシバミ
11,市川 治次,イチカワ ハルジ,男,A,1979/4/16,042-027-1262,090-6500-4574,itkw187@geocities.com ,187-0002,東京都小平市花小金井9-4-8 パレットハウス花小金井 515,トウキョウトコダイラシハナコガネイ
12,柴田 茜,シバタ アカネ,女,AB,1975/10/4,0859-87-7168,090-3300-8336,akane-sibata@asp.home.ne.jp ,683-0337,鳥取県西伯郡南部町落合9-9-2 セレッソ落合,トットリケンサイハクグンナンブチョウオチアイ
13,市川 要子,イチカワ ヨウコ,女,A,1977/9/30,049-491-8713,,yuk_itkw@nifty.jp ,350-0042,埼玉県川越市中原町1-4-5,サイタマケンカワゴエシナカハラマチ
14,坂口 喜久郎,サカグチ キクオ,男,B,1992/4/1,0460-10-3031,090-2306-5824,kikuo@iij.ad.jp ,250-0404,神奈川県足柄下郡箱根町宮ノ下4-7-6,カナガワケンアシガラシモグンハコネマチミヤノシタ
15,川野 愛,カワノ アイ,女,AB,1973/3/9,0587-35-7742,070-7674-7856,a483@hotmail.com ,483-8222,愛知県江南市赤童子町藤宮8-9-1,アイチケンコウナンシアカドウジチョウフジミヤ
16,永井 義郎,ナガイ ヨシオ,男,B,1982/12/21,0284-59-4146,090-1387-1560,yso-ngi@nifty.jp ,329-4214,栃木県足利市多田木町6079,トチギケンアシカガシタダキチョウ
17,前田 佐十郎,マエタ サジュウロウ,男,AB,1980/10/6,0958-77-0317,090-7681-8742,,850-0941,長崎県長崎市高丘9-11-1 シャトル高丘 910,ナガサキケンナガサキシタカオカ
18,荒木 望,アラキ ノゾミ,女,B,1983/12/28,0765-77-2368,070-6155-1661,nozomi_araki@sannet.ne.jp ,939-0612,富山県下新川郡入善町藤原3-7-4 ミレニアム藤原 12F,トヤマケンシモニイカワグンニュウゼンマチフジワラ
19,福永 幹也,フクナガ ミキヤ,男,O,1985/2/19,017-383-7967,090-2291-2697,aganukuh@freeml.co.jp ,030-0948,青森県青森市虹ヶ丘9-14-5,アオモリケンアオモリシニジガオカ
20,森本 久仁夫,モリモト クニオ,男,A,1991/7/29,0566-42-9742,090-1948-0672,morimoto91@mesh.ne.jp ,472-0011,愛知県知立市昭和5-7-7 昭和アパート1号 1502,アイチケンチリュウシショウワ
21,土田 尊則,ツチダ タカノリ,男,O,1976/9/23,0254-82-6059,070-6643-4704,takanoritutida@livedoor.com ,958-0051,新潟県村上市岩船上町6-11-8-9F,ニイガタケンムラカミシイワフネカンマチ
22,金田 義隆,カナダ ヨシタカ,男,B,1993/7/15,028-822-4347,,yositaka321@example.jp ,321-2114,栃木県宇都宮市下金井町6-9-4,トチギケンウツノミヤシシモカナイマチ
23,篠崎 洋助,シノサキ ヨウスケ,男,O,1972/5/14,0823-60-7965,090-5757-5422,yousuke1972@web.ad.jp ,734-0101,広島県呉市豊浜町豊島3-15-5,ヒロシマケンクレシトヨハマチョウトヨシマ
24,長島 季雄,ナガシマ スエオ,男,A,1989/5/28,0287-86-5922,070-3908-8904,sueo@example.net ,329-2731,栃木県那須塩原市二つ室3-6-4,トチギケンナスシオバラシフタツムロ
25,若林 照也,ワカバヤシ テルヤ,男,O,1990/4/22,025-145-1504,090-2714-0647,wakabayasi-teruya@example.com ,950-0902,新潟県新潟市南万代町6-11-3 シャンポール南万代町 1407,ニイガタケンニイガタシミナミバンダイチョウ
26,北原 厚成,キタハラ アツナリ,男,B,1976/4/22,0563-93-6194,070-4055-5841,atunari6194@mail.goo.ne.jp ,445-0835,愛知県西尾市肴町2-8-3 パナハイツ肴町 9F,アイチケンニシオシサカナマチ
27,竹中 征四郎,タケナカ セイシロウ,男,A,1983/1/4,025-996-5520,090-7391-7892,seisirou622505@infoseek.jp ,950-0902,新潟県新潟市南万代町6-2-2 パストラル南万代町 505,ニイガタケンニイガタシミナミバンダイチョウ
28,谷川 三光,ヤガワ ミツテル,男,A,1985/7/26,0721-29-7791,090-9131-9874,awagay85@example.or.jp ,585-0002,大阪府南河内郡河南町一須賀8-4-7,オオサカフミナミカワチグンカナンチョウイチスカ
29,丹羽 一智,ニワ カズトモ,男,B,1982/3/14,054-301-2549,090-2298-8175,kazutomo0314@livedoor.com ,420-0016,静岡県静岡市葵区住吉町2-8-6 パレットハウス住吉町 8F,シズオカケンシズオカシアオイクスミヨシチョウ
30,金田 栄之介,カネタ エイノスケ,男,AB,1994/5/7,0257-30-8969,070-7661-8496,einosuke94@example.co.jp ,945-1244,新潟県柏崎市水上2-5-7,ニイガタケンカシワザキシミズカミ
31,八木 伸次郎,ヤギ シンジロウ,男,A,1979/10/30,0888-38-3867,090-7047-2571,yagi.sinzirou@sannet.ne.jp ,780-8084,高知県高知市槇山町7-5-8,コウチケンコウチシマキヤマチョウ
32,稲葉 絢子,イナバ アヤコ,女,AB,1977/4/29,0439-39-4415,090-6288-7653,inabaabani@sannet.ne.jp ,299-1152,千葉県君津市久保6-14-7,チバケンキミツシクボ
33,和田 軍市,ワダ グンイチ,男,O,1976/12/29,0895-34-4876,,wd_gnt19831031@geocities.com ,798-3352,愛媛県宇和島市津島町坪井3-14-2,エヒメケンウワジマシツシマチョウツボイ
34,小松 淳子,コマツ アツコ,女,O,1993/4/2,0744-40-7076,090-2574-9827,atuko_komatu@dsn.ad.jp ,636-0221,奈良県磯城郡田原本町八田9-9-6 パナハイツ八田,ナラケンシキグンタワラモトチョウハッタ
35,平川 知生,ヒラカワ トモオ,男,O,1992/1/30,0537-00-2837,,oomot0130@nifty.com ,436-0072,静岡県掛川市印内7-3-9,シズオカケンカケガワシインナイ
36,河野 理絵,コウノ リエ,女,A,1972/7/12,03-3477-9191,090-2948-8858,kun.re@example.co.jp ,114-0014,東京都北区田端9-10-8-307号室,トウキョウトキタクタバタ
37,大村 裕香,オオムラ ユウカ,女,O,1970/11/24,086-735-6497,070-1505-6719,oomuraarumoo@combzmail.jp ,710-0006,岡山県倉敷市祐安3-11-6,オカヤマケンクラシキシスケヤス
38,嶋田 憲志,シマダ ノリユキ,男,A,1994/5/28,072-848-3400,090-0539-4730,nryksmd@sannet.ne.jp ,597-0095,大阪府貝塚市港3739,オオサカフカイヅカシミナト
39,川本 森勝,カワモト モリカツ,男,O,1987/4/23,07435-7-4272,090-9185-7765,kwmt87@nifty.com ,639-1013,奈良県大和郡山市朝日町3-13-5,ナラケンヤマトコオリヤマシアサヒチョウ
40,石塚 さやか,イシヅカ サヤカ,女,O,1985/7/9,0982-85-6934,090-2346-9525,isiduka-sayaka@mail.goo.ne.jp ,882-0084,宮崎県延岡市宇和田町8-12-5,ミヤザキケンノベオカシウワダマチ
41,柳沢 一城,ヤナギサワ カズキ,男,O,1977/3/21,0954-19-1592,090-7133-1893,kzk_yngsw@livedoor.com ,849-2303,佐賀県武雄市山内町三間坂3-5-2,サガケンタケオシヤマウチチョウミマサカ
42,武田 久江,タケダ ヒサエ,女,B,1975/4/30,03-3860-1276,090-6652-6097,takeda20070404@eaccess.net ,114-0005,東京都北区栄町1-11-2,トウキョウトキタクサカエチョウ
43,藤岡 典生,フジオカ ノリオ,男,A,1983/9/30,0220-52-8819,090-8834-6639,huziokatiki@tiki.ne.jp ,987-0425,宮城県登米市南方町梶沼前4-2-9,ミヤギケントメシミナミカタマチカジヌママエ
44,川原 兵吉,カワハラ ヒョウキチ,男,A,1988/12/16,076-640-5071,070-2964-3818,hyoukiti@plala.or.jp ,920-0818,石川県金沢市大樋町9-6-9,イシカワケンカナザワシオオヒマチ
45,村瀬 永寿,ムラセ エイジュ,男,A,1993/12/19,0254-02-8112,090-4899-9314,eijumurase@dsn.ad.jp ,959-2051,新潟県阿賀野市七石4-2-9 七石第2ビル,ニイガタケンアガノシシチコク
46,中川 宗司,ナカガワ ムネシ,男,A,1987/6/13,0478-63-1843,090-0424-6527,isenum289@tokyo24.com ,289-0307,千葉県香取市増田5-11-9,チバケンカトリシマシタ
47,上野 知明,ウエノ トモアキ,男,A,1971/10/1,092-990-1827,090-8465-7264,tomoaki-ueno@sakura.ne.jp ,811-2113,福岡県糟屋郡須惠町須惠6-4-6,フクオカケンカスヤグンスエマチスエ
48,水谷 勝人,ミズタニ カツト,男,O,1972/12/14,078-831-3466,090-2008-0715,katuto@anet.ne.jp ,657-0035,兵庫県神戸市灘区友田町5-12-2,ヒョウゴケンコウベシナダクトモダチョウ
49,大島 宏弥,オオシマ ヒロヤ,男,B,1982/12/27,0955-04-2480,090-8463-0859,hry1227dti@dti.ad.jp ,849-4263,佐賀県伊万里市山代町西大久保4-11-9,サガケンイマリシヤマシロチョウニシオオクボ
50,五十嵐 希和,イカラシ キワ,女,O,1990/8/2,099-670-4894,090-9054-1863,,892-0846,鹿児島県鹿児島市加治屋町8-7-3 カーム加治屋町 201号室,カゴシマケンカゴシマシカジヤチョウ
51,岸 要子,キシ ヨウコ,女,O,1984/8/20,0866-84-0766,090-4744-0361,youko0766@sunfield.ne.jp ,716-0045,岡山県高梁市中原町8-12-9,オカヤマケンタカハシシナカバラチョウ
52,出口 美波留,デグチ ミハル,女,O,1994/12/7,0884-04-3039,090-4738-1747,deguti94@hi-ho.ne.jp ,771-5325,徳島県那賀郡那賀町平野5-5-8,トクシマケンナカグンナカチョウヒラノ
53,沢田 優子,サワダ ユウコ,女,A,1971/7/18,042-947-0864,090-7571-9654,sawada0718@example.ad.jp ,190-0166,東京都あきる野市舘谷台5-14-7,トウキョウトアキルノシタテヤダイ
54,坂本 金義,サカモト カネヨシ,男,O,1985/4/13,0276-07-5556,070-3162-7563,sakamoto-kaneyosi@livedoor.com ,373-0035,群馬県太田市藤久良町5149,グンマケンオオタシフジクラチョウ
55,本間 弘春,ホンマ ヒロハル,男,O,1977/3/14,0569-08-2682,070-8137-0516,honma0314@dion.ne.jp ,479-0009,愛知県常滑市平池9-11-7,アイチケントコナメシヒライケ
56,林田 明博,ハヤシダ アキヒロ,男,B,1979/7/1,0531-16-5990,090-0038-8124,orihika@comeon.to ,441-3408,愛知県田原市吉胡台5085,アイチケンタハラシヨシゴダイ
57,今野 百世,コンノ モモヨ,女,A,1993/8/12,0235-50-5791,070-6051-1703,konno1993@example.ad.jp ,997-1337,山形県東田川郡三川町小尺9-3-1,ヤマガタケンヒガシタガワグンミカワマチショウシャク
58,森田 真琴,モリタ マコト,女,O,1994/7/21,098-525-0036,090-6936-9001,moritamakoto@infoweb.ne.jp ,901-2315,沖縄県中頭郡北中城村荻道3-2-7,オキナワケンナカガミグンキタナカグスクソンオギドウ
59,久保田 玲,クボタ レイ,女,O,1978/9/24,050-1855-6628,070-9499-3479,rei6628@gmail.com ,571-0075,大阪府門真市下島町2-6-5,オオサカフカドマシシモシマチョウ
60,宮川 常一,ミヤカワ ツネカズ,男,A,1988/7/16,025-535-7756,070-9151-5155,tunekazu1988@example.ne.jp ,949-7133,新潟県南魚沼市法音寺4-9-4,ニイガタケンミナミウオヌマシホウオンジ
61,鈴木 美次,スズキ ヨシツグ,男,A,1976/4/17,088-266-9411,090-0679-8982,ystg9411@users.gr.jp ,771-1302,徳島県板野郡上板町七條8-10-5-14F,トクシマケンイタノグンカミイタチョウシチジョウ
62,石井 三光,イシイ ミツテル,男,O,1989/7/31,0493-31-6211,090-8936-6675,,355-0305,埼玉県比企郡小川町能増9-15-4,サイタマケンヒキグンオガワマチノウマス
63,森本 泰央,モリモト ヤスオ,男,A,1993/12/4,024-437-4031,090-2832-3047,tmrm4031@yahoo.co.jp ,963-8804,福島県郡山市北畑7079,フクシマケンコオリヤマシキタバタケ
64,小柳 時代,コヤナギ トキヨ,女,A,1979/8/1,03-3220-0644,090-3167-9554,tkykyng@sannet.ne.jp ,157-0077,東京都世田谷区鎌田5-3-2,トウキョウトセタガヤクカマタ
65,篠崎 志津恵,シノサキ シズエ,女,AB,1973/11/25,05362-9-9767,090-5661-6282,sizue@example.ad.jp ,441-1303,愛知県新城市牛倉1-1-7,アイチケンシンシロシウシグラ
66,堀口 夕子,ホリグチ ユウコ,女,B,1974/10/31,025-350-1214,070-2463-9845,horiguti8109@dion.ne.jp ,949-3235,新潟県上越市柿崎区荻谷8-10-9,ニイガタケンジョウエツシカキザキクオギノタニ
67,渡部 水泉,ワタナベ スイセン,男,O,1971/6/7,03-3491-7466,070-5699-8475,ebanataw7466@dti.ad.jp ,132-0035,東京都江戸川区平井1-9-1,トウキョウトエドガワクヒライ
68,畠山 英造,ハタケヤマ エイゾウ,男,A,1977/4/14,0248-87-4697,070-8829-7709,htkym0414@tiki.ne.jp ,969-0103,福島県西白河郡泉崎村北平山5-2-6 北平山ハイツA 309号室,フクシマケンニシシラカワグンイズミザキムラキタヒラヤマ
69,白川 哲昭,シラカワ テツアキ,男,B,1977/2/19,0853-56-2947,090-5261-4714,tetuakisirakawa@anet.ne.jp ,693-0505,島根県出雲市佐田町吉野7143,シマネケンイズモシサダチョウヨシノ
70,松浦 重則,マツウラ シゲノリ,男,A,1994/2/8,026-277-3847,090-2635-8048,matuura@anet.ne.jp ,380-0934,長野県長野市中御所町2-15-4,ナガノケンナガノシナカゴショマチ
71,三宅 保二,ミヤケ ヤスジ,男,O,1970/7/28,0258-77-8802,090-2723-1994,yasuzi458613@example.ad.jp ,940-2111,新潟県長岡市三ツ郷屋4-5-8-613,ニイガタケンナガオカシミツゴウヤ
72,飯島 幸村,イイジマ ユキムラ,男,O,1993/3/24,075-883-4243,090-7806-2043,izm02izm02@example.co.jp ,615-0924,京都府京都市右京区梅津尻溝町4-14-3,キョウトフキョウトシウキョウクウメヅシリミゾチョウ
73,三輪 雅栄,ミワ マサエ,男,O,1989/6/28,086-791-7998,090-4369-1731,easam1989@mxi.asp.home.ne.jp ,710-0807,岡山県倉敷市西阿知町2104,オカヤマケンクラシキシニシアチチョウ
74,大森 希美,オオモリ ノゾミ,女,A,1989/8/23,0768-94-5694,090-9116-2939,omrnzmomrnzm@combzmail.jp ,928-0336,石川県鳳珠郡能登町北河内8-9-5 ハイツドリーム北河内 6階,イシカワケンホウスグンノトチョウキタカワチ
75,堀内 玲子,ホリウチ レイコ,男,A,1979/9/6,03-3950-5359,090-8497-1334,horiuti1110025@infoseek.jp ,111-0025,東京都台東区東浅草2-6-7,トウキョウトタイトウクヒガシアサクサ
76,竹中 忠博,タケナカ タダヒロ,男,O,1994/11/7,0426-06-0747,070-0724-5239,,192-0054,東京都八王子市小門町6-6-9 栄ビル 1506,トウキョウトハチオウジシオカドマチ
77,清水 多恵子,シミズ タエコ,女,A,1985/2/27,042-161-2205,090-0192-8760,simizu_taeko@nifty.com ,206-0821,東京都稲城市長峰1-3-8,トウキョウトイナギシナガミネ
78,上原 秀俊,ウエハラ ヒデトシ,男,O,1978/3/17,0586-70-1301,070-1265-0426,hdts491@plala.or.jp ,491-0361,愛知県一宮市萩原町林野7-2-4 ミレニアム萩原町林野 315号室,アイチケンイチノミヤシハギワラチョウハヤシノ
79,小笠原 多佳司,オガサハラ タカシ,男,O,1982/2/20,0166-26-6574,090-9643-2840,skt8228tks@plala.or.jp ,079-8411,北海道旭川市永山一条8-12-8,ホッカイドウアサヒカワシナガヤマ１ジョウ
80,花田 安民,ハナダ ヤスタミ,男,A,1971/9/21,0152-54-9934,,imatusay9934@mail.goo.ne.jp ,092-0222,北海道網走郡津別町上里5-10-3 サンハイツ上里 605号室,ホッカイドウアバシリグンツベツチョウカミサト
81,菊池 忠和,キクチ タダカズ,男,O,1973/9/3,0153-10-3464,070-3293-4043,tkk73@dion.ne.jp ,087-0022,北海道根室市昭和町7-10-8 ベルピア・昭和町 1111号室,ホッカイドウネムロシショウワチョウ
82,清水 浩一郎,シミズ コウイチロウ,男,A,1986/10/26,03-3756-6849,090-8151-8236,simizu86@example.ac.jp ,144-0047,東京都大田区萩中6-9-6,トウキョウトオオタクハギナカ
83,岡本 宏機,オカモト ヒロキ,男,O,1975/3/3,03-3697-1603,090-1704-8316,hiroki.okamoto@ocn.ne.jp ,130-0022,東京都墨田区江東橋8-10-8,トウキョウトスミダクコウトウバシ
84,高松 美紀,タカマツ ミキ,女,A,1987/1/16,042-642-4491,090-0948-7715,tkmtmk@coara.or.jp ,206-0036,東京都多摩市中沢7220,トウキョウトタマシナカザワ
85,浜田 戴三,ハマダ タイゾウ,男,A,1977/1/26,052-897-6392,090-0406-7624,uoziat4540059@example.co.jp ,454-0059,愛知県名古屋市中川区福川町8-10-3 福川町パレス 202,アイチケンナゴヤシナカガワクフクカワチョウ
86,宮沢 知生,ミヤザワ トモオ,男,B,1970/4/25,03-3824-7141,090-7836-2969,tmo.myzw@example.co.jp ,158-0081,東京都世田谷区深沢6612,トウキョウトセタガヤクフカサワ
87,西沢 庸司,ニシザワ ヨウジ,男,A,1977/5/14,06-6143-6275,070-3517-5601,youzi4141@freeml.co.jp ,561-0864,大阪府豊中市夕日丘4-14-1,オオサカフトヨナカシユウヒガオカ
88,飯塚 勝許,イイツカ カツモト,男,B,1975/3/3,0152-32-0011,070-7343-5948,ktmt_itk@tokyo24.com ,093-0007,北海道網走市南七条東7-2-7 サンコーポラス南七条東,ホッカイドウアバシリシミナミ７ジョウヒガシ
89,柏木 兼典,カシワギ カネノリ,男,B,1992/1/25,076-556-4400,090-9478-2158,kanenori92@dti.ne.jp ,939-2406,富山県富山市八尾町乗嶺6-1-6,トヤマケントヤマシヤツオマチノリミネ
90,細川 有子,ホソカワ ユウコ,女,O,1991/12/17,03-3168-4326,070-1295-9484,yuuko91yuuko91@dti.ne.jp ,157-0075,東京都世田谷区砧公園4-15-7,トウキョウトセタガヤクキヌタコウエン
91,江口 孝彦,エグチ タカヒコ,男,B,1972/9/18,03-3621-7259,090-0556-0751,ituge0918@plala.or.jp ,101-0038,東京都千代田区神田美倉町2707,トウキョウトチヨダクカンダミクラチョウ
92,星 勝行,ホシ カツユキ,男,B,1978/3/1,0742-29-1719,090-4290-5201,hosi0301@combzmail.jp ,630-8217,奈良県奈良市橋本町1-5-5 サンシャイン橋本町 1202号室,ナラケンナラシハシモトチョウ
93,岩本 世弥,イワモト セイヤ,男,AB,1990/4/14,0175-25-8562,090-4515-9691,seiyaiwamoto@infoseek.jp ,039-2613,青森県上北郡東北町野田尻8-12-4,アオモリケンカミキタグントウホクマチノダジリ
94,西村 智子,ニシムラ トモコ,女,A,1979/7/12,028-013-7729,090-8326-2068,,321-2117,栃木県宇都宮市岩原町6-9-8,トチギケンウツノミヤシイワハラマチ
95,宮城 澄夫,ミヤギ スミオ,男,O,1981/9/26,0585-78-6958,090-2059-1490,miyagi0926@freeml.co.jp ,501-0812,岐阜県揖斐郡揖斐川町櫨原4-14-3,ギフケンイビグンイビガワチョウハゼハラ
96,平田 美樹,ヒラタ ミキ,女,A,1976/12/6,0428-52-8138,090-5791-5769,miki1206@comeon.to ,198-0082,東京都青梅市仲町4-10-2,トウキョウトオウメシナカチョウ
97,吉原 博男,ヨシハラ ヒロオ,男,AB,1974/4/10,042-351-2017,,oorih0410@hotmail.com ,190-0202,東京都西多摩郡檜原村藤原2-14-2,トウキョウトニシタマグンヒノハラムラフジワラ
98,津田 光保,ツダ ミツホ,男,O,1972/3/4,075-513-5391,090-8986-7841,td@yahoo.co.jp ,600-8334,京都府京都市下京区西若松町3-9-2-5F,キョウトフキョウトシシモギョウクニシワカマツチョウ
99,池上 田鶴子,イケガミ タヅコ,女,A,1976/2/10,04994-2-2358,090-0615-0801,ikgmtdk@aitai.ne.jp ,100-1211,東京都三宅島三宅村坪田8-8-6,トウキョウトミヤケジマミヤケムラツボタ
100,永井 準郎,ナガイ ジュンロウ,男,B,1980/9/18,03-3703-1634,090-0309-9846,ign@plala.or.jp ,121-0052,東京都足立区六木8-9-6,トウキョウトアダチクムツキ
